{
  "$schema": "https://json-schema.org/draft/2020-12/schema",
  "$id": "https://hermes.local/dfm/topology-map.schema.json",
  "title": "Hermes DFM Topology To Render Mesh Map",
  "type": "object",
  "additionalProperties": false,
  "required": ["schema_version", "map_id", "run_id", "input_sha256", "scene_ref", "faces"],
  "properties": {
    "schema_version": {"const": 1},
    "map_id": {"type": "string", "minLength": 1},
    "run_id": {"type": "string", "minLength": 1},
    "input_sha256": {"type": "string", "pattern": "^[0-9a-f]{64}$"},
    "scene_ref": {"type": "string", "minLength": 1},
    "faces": {
      "type": "array",
      "items": {
        "type": "object",
        "additionalProperties": false,
        "required": ["geometry_ref", "triangle_refs"],
        "properties": {
          "geometry_ref": {"$ref": "#/$defs/geometryRef"},
          "triangle_refs": {"type": "array", "items": {"$ref": "#/$defs/triangleRef"}}
        }
      }
    }
  },
  "$defs": {
    "geometryRef": {
      "type": "object",
      "additionalProperties": false,
      "required": ["kind", "index", "input_sha256"],
      "properties": {
        "kind": {"const": "face"},
        "index": {"type": "integer", "minimum": 0},
        "input_sha256": {"type": "string", "pattern": "^[0-9a-f]{64}$"}
      }
    },
    "triangleRef": {
      "type": "object",
      "additionalProperties": false,
      "required": ["primitive_id", "triangle_id"],
      "properties": {
        "primitive_id": {"type": "string", "minLength": 1},
        "triangle_id": {"type": "integer", "minimum": 0}
      }
    }
  }
}
