{
  "schema_version": 1,
  "map_id": "topology_golden_part",
  "run_id": "run_1",
  "input_sha256": "aaaaaaaaaaaaaaaaaaaaaaaaaaaaaaaaaaaaaaaaaaaaaaaaaaaaaaaaaaaaaaaa",
  "scene_ref": "scene_golden_part",
  "faces": [
    {
      "geometry_ref": {
        "kind": "face",
        "index": 17,
        "input_sha256": "aaaaaaaaaaaaaaaaaaaaaaaaaaaaaaaaaaaaaaaaaaaaaaaaaaaaaaaaaaaaaaaa"
      },
      "triangle_refs": [
        {"primitive_id": "body-1", "triangle_id": 0},
        {"primitive_id": "body-1", "triangle_id": 1}
      ]
    }
  ]
}
